編號,案類,發生日期,發生時間,發生地點
1,汽車竊盜,1060103,0800,臺中市豐原區圳寮路內
2,汽車竊盜,1060103,1843,臺中市太平區長億六街
3,汽車竊盜,1060108,0800,臺中市龍井區文昌路與舊車路口文昌路上
4,汽車竊盜,1060114,2201,臺中市北屯區瀋陽路3段
5,汽車竊盜,1060116,0500,臺中市南區南和路
6,汽車竊盜,1060117,0637,臺中市烏日區榮泉路
7,汽車竊盜,1060118,0030,臺中市中區中山路
8,汽車竊盜,1060120,0430,臺中市太平區中山路2段350巷
9,汽車竊盜,1060122,0245,臺中市南屯區田心里向心路68巷
10,汽車竊盜,1060123,0855,臺中市豐原區中陽路與豐東路168巷
11,汽車竊盜,1060202,0305,臺中市太平區環太東路
12,汽車竊盜,1060203,1030,臺中市豐原區水源路與文村街
13,汽車竊盜,1060205,0605,臺中市南屯區三和里公益路2段
14,汽車竊盜,1060209,1400,臺中市清水區中清路9段與港埠路三段
15,汽車竊盜,1060210,2200,臺中市大肚區沙田路1段
16,汽車竊盜,1060214,0820,臺中市沙鹿區沙田路
17,汽車竊盜,1060214,1130,臺中市北屯區中平路與敦化路
18,汽車竊盜,1060215,0000,臺中市南區忠明南路與美村南路路口
19,汽車竊盜,1060215,1800,臺中市沙鹿區竹林里中山路紅竹巷
20,汽車竊盜,1060221,1600,臺中市清水區中社里忠誠路
21,汽車竊盜,1060223,2137,臺中市梧棲區四維西路與大仁路
22,汽車竊盜,1060303,1500,臺中市北屯區軍福九路與和祥五街附近工地空地
23,汽車竊盜,1060307,0330,臺中市西屯區西平南巷
24,汽車竊盜,1060307,0500,臺中市大里區大里里08鄰大里路451巷
25,汽車竊盜,1060309,1430,臺中市梧棲區台灣大道8段
26,汽車竊盜,1060311,0750,臺中市梧棲區自立路
27,汽車竊盜,1060312,0420,臺中市大肚區瑞井里遊園路1段115巷
28,汽車竊盜,1060315,0600,臺中市大肚區遊園路1段150巷
29,汽車竊盜,1060317,0730,臺中市神岡區神岡東街
30,汽車竊盜,1060317,1430,臺中市北區篤行路116巷
31,汽車竊盜,1060321,2030,臺中市南區德富路與大慶街一段130巷口
32,汽車竊盜,1060322,1618,臺中市北屯區南興一路與東山路91巷口
33,汽車竊盜,1060322,2100,臺中市北屯區松竹路1段350巷
34,汽車竊盜,1060323,0000,臺中市南區南平路與高院路
35,汽車竊盜,1060323,0427,臺中市豐原區豐原大道1段
36,汽車竊盜,1060324,0730,臺中市豐原區水源路9巷
37,汽車竊盜,1060324,2200,臺中市大甲區經國路
38,汽車竊盜,1060330,1205,臺中市豐原區豐勢路二段
39,汽車竊盜,1060331,1500,臺中市北屯區?子里太順路
40,汽車竊盜,1060404,2230,臺中市北屯區四平路
41,汽車竊盜,1060410,1630,臺中市烏日區五光路公園三街口
42,汽車竊盜,1060416,2045,臺中市神岡區提南路大甲溪國道四號便橋上
43,汽車竊盜,1060420,0513,臺中市北區立人里中清路1段
44,汽車竊盜,1060420,1405,臺中市南區南和路11巷
45,汽車竊盜,1060421,0403,臺中市豐原區朴子里豐勢路2段855巷
46,汽車竊盜,1060421,0403,臺中市豐原區朴子里豐勢路2段855巷
47,汽車竊盜,1060422,1730,臺中市大甲區信義與育英路口
48,汽車竊盜,1060423,0740,臺中市大里區新仁里016鄰立仁路57巷
49,汽車竊盜,1060424,0820,臺中市南區建國北路與民興街
50,汽車竊盜,1060425,1230,臺中市北屯區松竹路與山西路口
51,汽車竊盜,1060429,1958,臺中市西屯區福林里27鄰西屯路3段
52,汽車竊盜,1060508,2000,臺中市大肚區向上路5段
53,汽車竊盜,1060509,0930,臺中市霧峰區四德路136巷
54,汽車竊盜,1060510,2200,臺中市南區和昌街與福南路口
55,汽車竊盜,1060515,1400,臺中市太平區永成北路
56,汽車竊盜,1060518,1520,臺中市東區自由二街與富榮街
57,汽車竊盜,1060520,0550,臺中市豐原區三環路
58,汽車竊盜,1060525,0500,臺中市南區永南街
59,汽車竊盜,1060526,0220,臺中市北屯區經貿東路
60,汽車竊盜,1060526,2040,臺中市豐原區豐原大道4段
61,汽車竊盜,1060529,1430,臺中市大雅區中和七路
62,汽車竊盜,1060530,1130,臺中市北屯區忠平里14鄰陳平路65巷
63,汽車竊盜,1060531,0600,臺中市南區五權南路368巷
64,汽車竊盜,1060531,1900,臺中市東區精武路
65,汽車竊盜,1060602,2230,臺中市北區中達里育德路
66,汽車竊盜,1060604,1300,臺中市北屯區平興里10鄰柳陽東街
67,汽車竊盜,1060604,1450,臺中市烏日區高鐵三路土地公廟旁
68,汽車竊盜,1060604,1612,臺中市西屯區工業區一路
69,汽車竊盜,1060604,2300,臺中市石岡區豐勢路
70,汽車竊盜,1060605,0400,臺中市西屯區龍門一街
71,汽車竊盜,1060605,1130,臺中市大里區國光橋旁產業道路
72,汽車竊盜,1060606,0248,臺中市大里區新興路99巷
73,汽車竊盜,1060609,0408,臺中市東區東英路
74,汽車竊盜,1060609,1400,臺中市北屯區敦化路與敦化三街
75,汽車竊盜,1060609,2000,臺中市霧峰區甲堤六街
76,汽車竊盜,1060612,2000,臺中市西屯區安林段
77,汽車竊盜,1060613,0810,臺中市東區東英路
78,汽車竊盜,1060617,1100,臺中市沙鹿區北勢東路
79,汽車竊盜,1060618,0900,臺中市豐原區豐勢路1段
80,汽車竊盜,1060619,0200,臺中市北屯區北屯路
81,汽車竊盜,1060619,0900,臺中市豐原區富陽路235巷
82,汽車竊盜,1060621,2323,臺中市梧棲區大智路2段與四維東路
83,汽車竊盜,1060624,1930,臺中市西屯區凱旋三街
84,汽車竊盜,1060626,0830,臺中市大里區大智路鳥竹圍公園
85,汽車竊盜,1060627,2130,臺中市北區健行路
86,汽車竊盜,1060629,1059,臺中市大雅區東大路2段
87,汽車竊盜,1060630,1400,臺中市南區高工路
88,汽車竊盜,1060704,0930,臺中市大肚區社腳里沙田路1段774巷
89,汽車竊盜,1060705,0500,臺中市東區龍安街
90,汽車竊盜,1060707,0342,臺中市大里區鳥竹圍公園
91,汽車竊盜,1060711,0315,臺中市沙鹿區正英路382巷
92,汽車竊盜,1060712,0010,臺中市烏日區螺潭里光明路
93,汽車竊盜,1060712,0408,臺中市北屯區松竹五路2段
94,汽車竊盜,1060712,2305,臺中市東區旱溪東路1段
95,汽車竊盜,1060717,2157,臺中市西區大業路、精美街
96,汽車竊盜,1060721,0600,臺中市豐原區角潭路2段
97,汽車竊盜,1060721,1600,臺中市龍井區東海街
98,汽車竊盜,1060721,1600,臺中市清水區國姓里三美路
99,汽車竊盜,1060723,0117,臺中市大里區中興路2段747巷
100,汽車竊盜,1060724,0500,臺中市北區中清路與漢口路
101,汽車竊盜,1060726,0510,臺中市大雅區平和南街239巷
102,汽車竊盜,1060727,0730,臺中市北屯區安順東四街
103,汽車竊盜,1060728,0106,臺中市南區文心南路與建國南路
104,汽車竊盜,1060731,0630,臺中市西屯區臺灣大道四段1762巷內
105,汽車竊盜,1060808,2200,臺中市中區大誠里25鄰福音停車場內
106,汽車竊盜,1060809,0350,臺中市南屯區文山三街與保安七街
107,汽車竊盜,1060810,0740,臺中市清水區三美路
108,汽車竊盜,1060811,0415,臺中市北屯區水景里東山路1段
109,汽車竊盜,1060811,1100,臺中市南屯區保安一街與七星北街
110,汽車竊盜,1060814,0900,臺中市西區公益路155巷
111,汽車竊盜,1060816,0435,臺中市東區十甲東路
112,汽車竊盜,1060817,0900,臺中市北屯區軍功路與松竹路口旁的開放式公有停車場內
113,汽車竊盜,1060820,1300,臺中市龍井區龍崗里祥瑞路
114,汽車竊盜,1060822,2215,臺中市豐原區成功路
115,汽車竊盜,1060823,0704,臺中市大雅區民豐街204巷
116,汽車竊盜,1060824,2250,臺中市石岡區萬安里豐勢路
117,汽車竊盜,1060825,0120,臺中市東勢區新盛里東關路6段
118,汽車竊盜,1060827,0635,臺中市后里區三線路
119,汽車竊盜,1060828,0000,臺中市太平區東方街
120,汽車竊盜,1060828,0504,臺中市潭子區潭富二街
121,汽車竊盜,1060829,1130,臺中市北區漢口路4段
122,汽車竊盜,1060831,0005,臺中市西屯區國際街83巷
123,汽車竊盜,1060831,0035,臺中市西區篤行路
124,汽車竊盜,1060901,0400,臺中市清水區南社里民和路2段
125,汽車竊盜,1060902,2058,臺中市潭子區福潭路88巷
126,汽車竊盜,1060905,0934,臺中市大里區勝利二路
127,汽車竊盜,1060906,0240,臺中市沙鹿區北勢里北勢五街
128,汽車竊盜,1060912,0200,臺中市清水區中山路與中興街
129,汽車竊盜,1060913,0300,臺中市潭子區雅潭路3段
130,汽車竊盜,1060913,0909,臺中市大雅區永和路
131,汽車竊盜,1060913,2030,臺中市北屯區敦化路2段
132,汽車竊盜,1060914,0530,臺中市大里區仁化里仁愛路
133,汽車竊盜,1060914,1100,臺中市豐原區成功路131巷
134,汽車竊盜,1060915,2135,臺中市神岡區三民路
135,汽車竊盜,1060919,0841,臺中市神岡區大漢街
136,汽車竊盜,1060920,2317,臺中市北區精武路
137,汽車竊盜,1060922,1230,臺中市龍井區新興路27巷
138,汽車竊盜,1060925,0900,臺中市西屯區永安里12鄰西屯路3段90-30巷
139,汽車竊盜,1060925,1120,臺中市東區仁和一街
140,汽車竊盜,1060926,0100,臺中市豐原區鐮村路
141,汽車竊盜,1060928,0315,臺中市中區光復路
142,汽車竊盜,1061004,0809,臺中市霧峰區乾溪西側防汛道路國道3號橋下往南
143,汽車竊盜,1061010,0350,臺中市大肚區王田里10鄰興和路
144,汽車竊盜,1061010,1600,臺中市北區精武路
145,汽車竊盜,1061011,0800,臺中市梧棲區大智路2段195巷
146,汽車竊盜,1061011,2000,臺中市大甲區中山路1段
147,汽車竊盜,1061012,1400,臺中市潭子區環中東路1段
148,汽車竊盜,1061016,1630,臺中市南屯區豐樂里永順路與永春東二路
149,汽車竊盜,1061018,0433,臺中市沙鹿區東晉路與東英路
150,汽車竊盜,1061018,0520,臺中市西區存中街
151,汽車竊盜,1061022,1830,臺中市潭子區雅潭路2段
152,汽車竊盜,1061024,1710,臺中市沙鹿區沙田路
153,汽車竊盜,1061028,0800,臺中市東勢區北興里正五街
154,汽車竊盜,1061029,1925,臺中市北屯區梅川西4段
155,汽車竊盜,1061030,0830,臺中市后里區甲后路2段
156,汽車竊盜,1061101,2340,臺中市大雅區民生路四段樹德街口
157,汽車竊盜,1061103,1900,臺中市南屯區春安里春安三路近春安路口
158,汽車竊盜,1061105,0100,臺中市清水區南社里民權一街
159,汽車竊盜,1061105,0430,臺中市大雅區振興路
160,汽車竊盜,1061107,0430,臺中市龍井區龍昌路
161,汽車竊盜,1061107,1400,臺中市中區福音街
162,汽車竊盜,1061114,0730,臺中市西屯區惠來里青海路2段
163,汽車竊盜,1061116,1620,臺中市豐原區豐原大道8段旁
164,汽車竊盜,1061118,0415,臺中市北屯區新興路
165,汽車竊盜,1061120,0400,臺中市清水區大楊北街
166,汽車竊盜,1061120,0421,臺中市中區興民街
167,汽車竊盜,1061120,1500,臺中市新社區福興里台21線
168,汽車竊盜,1061121,0530,臺中市豐原區中山路652巷
169,汽車竊盜,1061123,0803,臺中市大雅區中清路四段860巷
170,汽車竊盜,1061124,0730,臺中市大里區益民路1段112巷
171,汽車竊盜,1061125,0544,臺中市東區十甲東路406巷
172,汽車竊盜,1061128,0915,臺中市新社區協成里協中街211巷
173,汽車竊盜,1061201,1816,臺中市沙鹿區中山路
174,汽車竊盜,1061204,0630,臺中市烏日區民權街
175,汽車竊盜,1061204,0943,臺中市沙鹿區洛泉里日新街61巷
176,汽車竊盜,1061205,2100,臺中市大雅區中清路五段
177,汽車竊盜,1061209,0500,臺中市大里區新仁路3段
178,汽車竊盜,1061219,0154,臺中市龍井區新庄里遊園南路136巷
179,汽車竊盜,1061220,1300,臺中市北區東光路與天祥街
180,汽車竊盜,1061220,1830,臺中市南區忠明南路與興大路口
181,汽車竊盜,1061223,0650,臺中市烏日區榮泉路
182,汽車竊盜,1061223,1420,臺中市西屯區惠來路52號巷
183,汽車竊盜,1061226,1240,臺中市西屯區河南路三段與市政北一路口
184,汽車竊盜,1061227,2300,臺中市東區東光園路
